{
  "schema_version": "1.0.0",
  "event_type": "job.state_changed",
  "event_id": "11111111-1111-4111-8111-111111111111",
  "idempotency_key": "job.state_changed:44444444-4444-4444-8444-444444444444:1",
  "correlation_id": "22222222-2222-4222-8222-222222222222",
  "occurred_at": "2026-04-25T23:55:00Z",
  "producer": "processor",
  "job_id": "44444444-4444-4444-8444-444444444444",
  "watcher_id": "33333333-3333-4333-8333-333333333333",
  "attempt_number": 1,
  "payload": {
    "previous_state": "DETECTED",
    "new_state": "DETECTED",
    "transition_reason": "demo",
    "stage_owner": "api"
  }
}
